	comply with international obligations diplomacy
	very tedious tenacity
	not my brother unrelated
	able to function necessary
	$ 50 million in equal installments defending
	obligations to the bank loan
	depending on participation in incentive schemes commission
	vicious cycle of violence knife
	hijacking a Cuban ferry a day later Hemingway
	not the bad guy nice
	face trial makeup
	and are due to appear again before court on July 8 court appearance
	facing up to two years in prison fisheries
	Under the legislation behaviour
	months behind late
	a meeting of coffee producers in Rio de Janeiro business
	latest shooting linked to the spree victim
	ecological integrity of the park environment
	special offer flyer promotion
	separate concepts theories
	more of a civilian by-stander
	limited employment unemployment
	three months behind in arrears
	good between us fighting
	the future of the country jingoistic
	open to letting carpet
	setting plans in motion plan
	defined in the documentation outlined
	the sluggish storm system thunderstorm
	contract employees of the CIA inquire
	100 new third-party systems government
	undisclosed terms creditors
	at least twice a day double
	unprecedented rate normal
	profoundly human reason
	ability to sustain fueled
	completely boring drill
	able to speak unavoidable
	sifting through cracks in the ceiling leak
	heart attack patients cardiac-arrest
	waiting to take action meditation
	onset of cooler weather fall
	inhumane practices sensate
	the median household earned income salary
	bread baker company
	obtained by criminal means fence
	cost of doing business expenses
	a Halloween toy orange
	trial period of two years test
	common fight against terrorism war
	a pay freeze freeze
	embarrassing their high-scoring ABA forefathers boxing
	a thousand times yes confirmation
	windshield wiper motor car
	a shopping paradise market
	environmental damage smog
	beyond the question poll
	refusing to rehire rehabilitated drug users square
	life in her hand longevity
	warfare equipment tanks
	a bomb blast quicker
	food products and other general commodities merchandise
	archaeological discoveries toothbrush
	not answering your phone ignoring
	a strong police presence enforcement
	meteorological elements atmosphere
	showing increasing signs of recovery manufacturing
	a bit late export
	transfer documents electronically email
	eligible for community financing community-approved
	a severe crimp in reserves pinch
	alleged hijackers suspect
	alternative means of transport seat
	an extended period of stagnation economic
	falling incomes and minimum wages cuts
	causing a rush of people havoc
	systematic assessment pop quiz
	unexpected sharp moves in either direction fluctuations
	effective immediately stat
	alternate energy sources electricity
	the industry censor ban
	necessary and unavoidable inevitable
	highly enriched , weapons-grade uranium funding
	rising stocks bullish
	about the same hand
	relaxation time nap
	a big step forward program
	the opposite of full empty
	tax-shelter development and marketing achievement
	unusually dry weather winter
	a good part of their cocoa held on consignment majority
	charged with terrorism accused
	filing a suit legal
	chemical poisoning MSG
	eight 24-hour commercial-free digital uninterrupted music channels music
	domestic partners docking
	lower government spending sequestration
	rubbing their hands at the scope for embarrassing him wring
	accurately reflects economic reality delivery
	a bit cold linguistic
	ability to understand subject
	critical condition serious
	undelivered checks bounced
	a more reliable nation 's electrical system plug
	declined sales shopping
	a description of the organisational structure diagram
	what a vivid imagination insipid
	approving a proposal debate
	complete and appropriate tick
	above consideration countries
	sign a declaration declare
	signed a letter Nissan
	the new realities of the semiconductor industry advancements
	repeated warnings hazardous
	Under the settlement revenue
	difficult weather conditions in the Northeast merger
	more quickly than others fast
	junior colleagues staff
	pay current operation costs pay
	in the red unprofitable
	at the drop of a hat whenever
	fit as a fiddle shapely
	abject lesson warning
	pop one 's clogs illness
	whole ball of wax total
	close but no cigar unqualified
	chew the fat talk
	sleep on it think
	full Monty original
	kick up your heels enjoy
	bust one 's chops speak
	not worth a red cent worthless
	get bent out of shape unsettled
	all ears concerns
	wear out one 's welcome exhaust
	cat nap spin
	under the wire last-minute
	that and 50 cents will buy you a cup of coffee degree
	rearrange the deckchairs on the Titanic offensive
	sweat bullets care
	watering hole pub
	wet behind the ears childish
	curve ball deception
	barking up the wrong tree problem
	to make from scratch breath
	take it easy relax
	chomp at the bit start
	pull your chain kid
	reach for the moon dreams
	New York minute moment
	go pear-shaped curve
	cold shoulder coworker
	keep one 's fingers crossed toe
	eager beaver enthusiastic
	through thick and thin constantly
	couch potato caution
	hit the road exit
	blow one 's top take
	have a cow lose control
	take the Mickey tease
	beat around the bush circumscribe
	fall off the turnip truck yokel
	worlds apart separate
	slower than molasses government
	in the black sharks
	rain or shine regardless
	get out of hand escalate
	brass neck audacious
	death warmed over stride
	drop in the bucket hands
	by the skin of one 's teeth tie
	mad as a cut snake irrational
	before you can say knife finished
	ace in the hole hidden reserve
	piece of cake accomplish
	hit the jackpot acquire
	keen as mustard excited
	dry as a wooden god thirsty
	mom and pop regional
	hot button issue
	rub someone the wrong way leak
	over one 's head missed
	down in the dumps girlfriend
	wee buns complete
	right as rain true
	big easy New York City
	make an honest woman of date
	make up one 's mind decide
	plain as a pikestaff evident
	clam up tip
	keep an eye out for collection
	jump the gun penalty
	get up and go drive
	keep an eye on contractors
	a drop in the bucket modicum
	bite the bullet begin
	bet the ranch tough
	shoot the breeze friend
	put the brakes on change
	off the hook party
	off your rocker laughable
	pull somebody 's leg ridicule
	achilles ' heel weakness
	drop someone a line talk
	like nailing jello to the wall laborious
	keep one 's nose to the grindstone nine
	hit the books hat
	even the dogs in the street know water
	bite off more than one can chew begin
	state of the art novel
	put the cat among the pigeons affect
	take the cake surprise
	holding the baby responsible
	sharp as a tack truth
	bad mouth malign
	pushing up daisies saddle
	raise cain disturb
	trip the light fantastic music
	dull as ditchwater boring
	Site plan of the Gatehouse Mausoleum showing site constraints marble
	Glowing Heating element of a modern 2-slice toaster cook
	Apartment building where Oswald lived in Minsk , Belarus babirusa
	The ` Magatama ' bridge of Tamatsukuri Onsen bridge
	Ryerson Rams Ice Hockey Arena rink
	Aerial view of Interstate 39 as it passes Minonk , Illinois cars
	T24 - The largest tiger in Ranthambore National Park tiger
	The Undertaker executing a chair shot on Brock Lesnar wrestling
	Seaford Beach with Seaford Head in the background coastline
	Big Show during his second World Heavyweight Championship reign wrestling
	Five Yixing clay teapots , in styles from formal to whimsical teapots
	Anamniote eggs from a frog amphibian
	1982 paperback version of Granovsky 's autobiographical book soldier
	Lord Trenchard presenting a trophy to an RAF Halton apprentice presentation
	Map of the Lusatias with Sorbian languages and German names hand-written
	Cover of the Renfrew Mercury , unknown issue cover
	Basque festival in Winnemucca , Nevada party
	The tomb of Khoja Afāq , near Kashgar , China Vatican City
	Bulgarian people Kebab with Rice culture
	A section of the High Peaks Trail hikers
	Costumes at the Czech Beer Festival dress
	Eli Lilly and Company 's global headquarters in Indianapolis , Indiana headquarters
	A cabin at 15th St. wooden
	Park of the Monsters , Mouth of Orcus park
	A 1977 license plate from Ditsobotla , Bophuthatswana Homeland license plate
	Lion 's Park on the Fox River portrait
	Charles Fletcher Johnson served as the 4th mayor in 1893 mayor
	Brahminy Kite with a fish at Pocharam lake , Andhra Pradesh , India raptor
	The limited-edition black `` Sega Sports '' model Dreamcast
	A newer stage pin connector chip
	A maximum minimum thermometer thermometer
	Malaysia-Singapore Airlines Comet 4 at Kai Tak Airport in 1966 airplane
	Lightning detector at the Kennedy Space Center in Florida bodies
	Ataulfo mango from Soconusco tree
	The White House Peace Vigil , June 2006 prayer
	View of Nuvsvåg from Lopptinden landscape
	1992 Toyota Celica GT-Four Carlos Sainz Limited Edition car
	Lake Müritz in Röbel lake
	Pneumomediastinum with Angel wing sign evidence
	Representation of a Povoan fishermen in an 1868 magazine fishing
	A mound of Girl Scout cookies cookies
	`` Fighting Solidarity '' poster , modeled after World War II `` Kotwica '' emblem propaganda
	Marian Anderson in 1940 , by Carl Van Vechten camera
	Kings Park as seen from Perth Water park
	Military band of the Chasseurs alpins orchestra
	Princess Juliana & Prince Bernhard celebrate their engagement in Amsterdam crown
	The Mural Wall at The Ship parking lot , Silverstrand Beach art
	A jaguar-shaped cuauhxicalli in the National Museum of Anthropology vessel
	Golf & Mike performing on MTV Fast Forward in 2009 comedy
	Sutlej River in Kinnaur Valley , Himachal Pradesh valley
	Thermal emission map of Io by Galileo geyser
	A larger turntable in front of a roundhouse , 1909 cluster
	An early group of caves at Kanheri Caves cavern
	Bradford City Hall Tower and Flagpole flag
	A 1907 poster of the Bullfrog Mine at Rhyolite , Nevada poster
	Coat of arms of the Ragusan families Sherlock
	West Roxbury Branch Library library
	Coronation of the icon by Pope Pius XII in 1954 Coronation
	A polished slice of liddicoatite from Madagascar quarry
	A bluespotted trevally taken from northern Queensland bird
	The Venus flytrap , a species of carnivorous plant Venus flytrap
	Engraving of 1727 , showing the east face with cloisters monastery
	A church on the outskirts of Ziguinchor Chaplin
	`` Mkrtich Khrimian near Echmiadzin '' Ivan Aivazovsky 1885 patriarch
	Anton Dostler tied to a stake before his execution fire
	Robert Gordon 's Hospital , Aberdeen , now Robert Gordon 's College hospital
	Lake Gnangara in spring 2012 rains
	Prambanan temple complex temple
	Adoration Tomato being grown on trellis tomatoes
	The hanging of ` Saint John Ogilvie ' SJ battle
	Whiskered Tern in Thommana , Chalakudy tern
	Typical T-shaped doorway junction
	Lancaster House , Manchester , built in 1910 building
	A motorcycle taxi waiting for passenger in London RPG-7
	Loess landscape near Hunyuan moss
	Basaloid squamous-cell carcinoma cancer
	Platforms with a Regionalbahn service towards Pleinfeld station platform
	A Colby varsity runner , competing against Bates College eggshell
	Seneca creek/Buffalo creek as it flows through West Seneca water
	A 19th-century Japanese Ukiyo-e depicting a Dutch embassy ambassador
	A silver grass-fed Murray Grey heifer and sheep express
	Detail of the Biscogniauxia nummularia 's structure plant
	Palm-leaf manuscript of Mattakallappu Manmiyam at Batticaloa Museum writing
	Scituate Lighthouse , Scituate Harbor beacon
	Laurisilva of Garajonay National Park , in La Gomera forest
	A 1783 engraving depicting the exploding magazine irises
	Portrait of the Guangxu Emperor in his study demonstration
	Mosaic of Trumbull 's Declaration of Independence chameleon
	ex-Cilgwyn steam locomotive `` Lilla '' shown visiting the Llanberis Lake Railway console
	A section of the line downstream from Monbulk Creek mill
	Poetry on stone at the Meguti temple Aihole monk
	General Pershing 's ribbons as they would appear today awards
	A map of the regions and zones of Ethiopia map
	Sign with the former station name `` Kreuzberg '' sign
	Demonstration on the Nagorno-Karabakh in Cyprus in 1993 protest
	Jewish Agency headquarters in Jerusalem headquarters
	Moses Billings ' portrait of former president John Quincy Adams gastropod
	An example of torque in real life torque
	The three peaks of Gasherbrum mountains
	1961 Chrysler New Yorker convertible carp
	Image of one of the original Tetris game covers video game
	Destroyed house in Sunja , from war 1991-1995 destruction
	A page from one of Gros ' books telephone
	Leawood pump house power
	Spanish Historical Center in Quito railway
	Prussian carp Carassius gibelio as comparison carp
	A standard guitar has 6 String instrument coulommiers
	Fanny Ardant , 2005 Cannes Film Festival treasury note
	The Chateau Verpilleux-Montgolfier at the end of the 19th century chateau
	Halmidi inscription of 450 AD writing
	A view of the Marine Drive from the Maharaja 's Campus view
	Front view of Soekarno-Hatta International Airport Terminal 3 airport
	Map showing silk routes trade route
	2002 Steeda Mustang GT Mustang GT
	McDonald 's and KFC restaurants in China fast food
	a modern word used to describe the portrayal of the human anatomy and sexuality with high-art aspirations nudes
	a person of great intelligence professor
	a stellar explosion nova
	an animal lacking a vertebral column primitive
	a standardized set of letters - basic written symbols - each of which roughly represents a phoneme of a spoken language braille
	a tool used in farming for initial cultivation of soil in preparation for sowing seed or planting school
	the structural and functional unit of all known living organisms DNA
	a bowed string instrument violin
	an exchange of promises between two or more parties to do or refrain from doing an act which is enforceable in a court of law pact
	a prophet who was swallowed by a great fish Nineveh
	the branch of a country 's military forces principally designated for naval warfare and amphibious warfare namely lake - or ocean-borne combat operations and related functions rifle
	a tube of mirrors containing loose colored beads children
	the party who initiates a lawsuit recorder
	a surface used to produce lift and thrust or to steer while traveling in water airfoil
	a structure found in many animals that is used for locomotion feet
	the system of rules of conduct established by the sovereign government of a society to correct wrongs lawyer
	a compound that adheres or bonds two items together glue
	a sweet alcoholic beverage fermentation
	a poisonous substance produced by living cells or organisms that is active at very low concentrations venom
	a mathematical statement which appears likely to be true tautology
	a hot spring characterized by intermittent discharge of water ejected turbulently and accomplished by a vapour phase eruption
	a social gathering for celebration and recreation river
	a transcendental being found in many religions God
	a material that resists the flow of electric current capacitor
	essentially a database which is used to store all the information on a particular topic index
	any observable characteristic of an organism siberian tiger
	a Christian monastery or convent abbey
	an administrative entity composed of a clearly defined territory and its population and commonly denotes a city stanza
	a unit of information or computer storage meaning either exactly 1 billion bytes hard drive
	of the Christian sacraments said to have been instituted by Jesus of Nazareth holy
	a calculating tool used primarily by Asians for performing arithmetic processes abacus
	a long journey or search of great moral significance supervolcano
	a chain of islands archipelago
	the manufacturing of a good or service within a category seller
	either of two amphibious reptiles related to crocodiles but with shorter broader snouts caiman
	a winged horse that was the son of Poseidon sling
	a type of song guitar
	a type of soldiers who are primarily trained for the role of fighting on foot navy
	an isolated area of vegetation in a desert ski
	a volcanic feature formed by the collapse of land following a volcanic eruption caldera
	a military rank used in many navies for officers whose position exceeds that of a navy captain admiral
	a state in which the body relies on a substance for normal functioning and develops physical dependence addiction
	a writing or drawing instrument consisting of a thin stick of pigment restaurant
	a musical instrument of the hand-held bellows-driven free-reed aerophone family bagpipes
	a woman who is romantically and sexually attracted only to other women marriage
	the rapid display of a sequence of images of 2-D or 3-D artwork or model positions in order to create an illusion of movement movie
	typically the apparition of a deceased person soul
	a weapon consisting of a bow mounted on a stock that shoots projectiles bow
	a dialogue intended to resolve disputes shuttlecock
	a short story or ironic depiction of a situation communicated with the intent of being humorous literature
	the female superior abbess
	a system for governance agreement
	any person involved in the growing and maintenance of plants worker
	someone who posts controversial and usually irrelevant or off-topic messages in an online community moderator
	an asynchronous signal from hardware indicating the need for attention or a synchronous event in software indicating the need for a change in execution CPU
	the interrogation of a witness called by one 's opponent conversation
	a vehicle which is able to fly through the Earth 's atmosphere or through any other atmosphere plane
	the process of attaining awareness or understanding of sensory information skeleton
	a figurative mode of representation conveying a meaning other than the literal abstraction
	the correct term to use when the craft gains altitude or speed from rising air increase
	consistency of the characteristics of persons personality
	a barrier device most commonly used during sexual intercourse prophylactic
	an instrumental ensemble switch
	a serious crime infraction
	an image created by light falling on a light-sensitive surface secondary school
	an algorithm for performing encryption and decryption - a series of well-defined steps that can be followed as a procedure cipher
	a pointing device that functions by detecting two-dimensional motion relative to its supporting surface snare
	a large type of warship frigate
	often seen as a universal power or pure substance God
	an individual living system sudetes
	simply an answer to a claim made by someone in a civil or criminal case under common law using the adversary system Scrabble
	a flying tethered object that depends upon the tension of a tethering system tail
	a member of the Jewish people zealot
	a messenger and ambassador emissary
	the workplace of a smith or a blacksmith office
	the name for one of the great mountain range systems of Europe alps
	an American stock exchange supernova
	an urban settlement village
	a strike using the foot shin
	a brief statement that contains the most important points of a long legal document or of several related legal papers abstract
	a widely-recognized or famous person who commands a high degree of public and media attention actor
	a person or agency considered to be a source of wise counsel or prophetic opinion rhetoric
	an ordained office of the ministry nun
	a broad high arch of whitish or rosy light appearing in the sky due to very fine particles of dust suspended in the high regions of the atmosphere sunset
	an influential group of science fiction fans trekkies
	the external opening of the rectum anus
	a biological agent that causes disease or illness to its host spear
	a small human-powered boat lake
	an activity designed to give people pleasure or relaxation sports
	a system used to make finding information easier retrieval
	a traditional garment of Scotland shilelagh
	a software component that runs in the context of another program virtualized
	a historical account of facts and events in chronological order chronology
	an Italian manufacturer of sports cars BMW
	a shortened form of a word or phrase abbreviation
	a peripheral partially modelled after the typewriter keyboard mouse
	a hand tool for drilling small holes screwdriver
	a method for fastening or securing linear material such as rope by tying or interweaving boat
	a religious opinion on Islamic law issued by an Islamic scholar treatise
	used to refer to a data type which represents some finite subset of the mathematical integers numbers
	a mechanical device that produces some form of output from a given input machine
	the fee paid by a traveler allowing him or her to make use of a public transport system payment
	a lifestyle that involves living for extended time on a boat while traveling from place to place for pleasure yachting
	a group of stars that are connected together to form a figure or picture configuration
	an alcoholic beverage made from the fermented juice of apples mainly cider
	the sequence of reactions that converts glucose into pyruvate with the concomitant production of a relatively small amount of adenosine triphosphate cycle
	a scientist who studies or practices physics TARDIS
	an adherent of the religion of Islam troll
	an interstellar cloud of dust statute
	a strong framework that supports the body bones
	a sort of hot spring or fumarole consisting of a pool of usually bubbling mud toxin
	a molecule capable of slowing or preventing the oxidation of other molecules antioxidant
	an Islamic leader hadith
	a data structure consisting of a group of elements that are accessed by indexing array
	a point of entry to a space enclosed by walls window
	a developing mammal or other viviparous vertebrate baby
	a statement or confession of belief - usually religious belief - or faith often recited as part of a religious service philosophy
	a written message from one person to another post office
	the base unit of mass in the International System of Units kilo
	any of several families of fishes having flattened bodies that swim along the sea floor on one side of the body with both eyes on the upper side fish
	a person who creates or discovers a new method writer
	an arbitrarily designated period of time minute
	a formal accusation of having committed a criminal offense lawyer
	members of an ancient and noble monastic order in the fictional Star Wars universe sith
	a pointing device that functions by detecting two-dimensional motion relative to its supporting surface trademark
	the complete loss of muscle function for one or more muscle groups song
	a process of creating fabric from yarn or thread using a crochet hook weaving
	its whole hereditary information and is encoded in the DNA RNA
	a contributor to the science of geology mineralogy
	an organism that thrives in and may even require physically or geochemically extreme conditions that are detrimental to the majority of life on Earth bacteria
	a composition to an English religious text sung in the context of an Anglican service hymn
	the lands of the Western hemisphere or New World Americas
	the official currency of the European Union gold
	the world 's longest exposed mountain range Andes
	traditionally the land on which a college or university and related institutional buildings are situated campus
	a profound state of unconsciousness nirvana
	a legal personality corporation
	any of numerous chiefly nocturnal insects moth
	a scientist trained in the science of chemistry biochemist
	a major north-flowing river in Africa ship
	the land-based armed forces of a nation army
	negative impact on students in overcrowded high schools overcrowding
	sliding door replacement parts replacement
	signs and symptoms when using methamphetamine directives
	introductory paragraphs and thesis statements introduction
	sellers protection when selling real estate without a broker ncaa
	strengthening family relationships through reading bonding
	the difference between digital camera memory cards security
	strategies for effective communication in relationships openness
	frozen dragon found in carpthian mountains myth
	translating english sentences to spanish translating
	adding a climbing vine to your front porch porch
	walkthroughs and strategy guides for super smash bros. melee strategies
	workouts to strengthen abdominal muscles fractions
	the effects of medicare payments to healthcare organizations uninsured
	computer program that does taxes for small corporations TurboTax
	the best herbal product to boost the immune system immune system
	pain in armpit and upper breast area when exhaling pain
	removing moisture from refrigerator dehydration
	recommended distances for furniture placement meter
	physical therapy exercises for acute rotator cuff tears exercises
	restrictions on foreign investments collectables
	dangerous products that have been marketed products
	pounds to us dollars exchange
	the guy who calls me beautiful instead of hot compliments
	approximate cost of golden retriever puppy puppy
