this question will become that much more relevant the closer EU enlargement towards the East become .	chinese zodiac
as the honourable Member of you House be aware , the lodging of a complaint have in itself no bearing on the progress of the project .	the main homeowner 's project be not affect by complaint
for example , for Finland it be vitally important that Russia be include in these agreement .	Russia 's critical presence in finnish agreement
let we have the political courage of we ecological ambition .	political courage to promote environmental protection
I must therefore express my scepticism about the result .	personal skepticism
another important proposal we have make , which will be of particular significance in the context of aviation noise , be that there should be a additional noise indicator over and above those that the rapporteur have enumerate .	aeroplane create loud noise
it be a document which my team and I feel be full of idea and proposal , which go to the heart of the issue and do not dodge any of the area of concern of the people of the outermost community .	coronary heart disease
the number of Americans with scottish or scotch-irish ancestry accord to the 2000 US Census be about 9.2 million , comprise 3.2 % of the US population .	american with scottish ancestry
.-lrb- el -rrb- we will not achieve safety at sea or protect human life at sea and the environment unless we address the unaccountability of shipowner , introduce strict control on the state of ship , impose heavy penalty on shipping company in breach of safety regulation , improve work time for seaman , train they properly and ensure that ship be crew in keep with they enhance requirement .	from top to bottom of the sea - a accountability to improve safety .
Defence Force chief David Hurley also claim professional behaviour of board officer and the Navy when handle arrive refugee boat .	hundred of volunteer
it be be a busy couple of day for security guru assign to keep they company safe and sound .	security it professional ' action
the President in no way , shape or form direct the Marine Corps to change we uniform cover .	Marine Corps uniform
BEA Systems Inc. .BEAS.O say on Thursday second-quarter profit rise 28 percent , as revenue grow slightly more than Wall Street expect amid a contracting overall market for business software .	the outgoing coalition of Social Democrats
I should also like to have answer to the question of what influence it would have on the volatility of the exchange market , particularly what would be the effect of a tax of 0.1 per thousand on speculator expect devaluation in the order of 20 to 50 % .	the effect of tax on exchange market volatility
the american Film Institute recently name she the top female screen legend .	best female actress
I would like to thank Mr Liikanen for what be in all respects a very positive and excellent reply .	grateful for a nice reply
Fiji 's national airline Air Pacific have now officially return to its original name : Fiji Airways .	the official return of Air Pacific 's original name
we should examine that very carefully and then pursue the implementation of both part of the combined approach , namely the establishment of limit value for the various source of noise on the one hand and quality standard for noise source on the other .	combine limit value with quality standard of the various source of noise
that apply both to the stricter requirement on the design of oil tanker , better rule on port state control and the tighten up of the rule on classification society that will also result from this .	improve regulation to help the environment
I be a bit happier with the attitude of the Council today than I be in July because , as on many occasion in situation of crisis , the European Union seem always to be the last authority to arrive on the international scene and make its voice hear .	happier to see the EU make its voice hear internationally in critical situation
in order to honour the political agreement make with the Council and the rapporteur to enable the regulation to be adopt at first reading , the Commission reject all other amendment which be not part of the Paciotti report adopt by the Committee on Citizens ' Freedoms and Rights , Justice and Home Affairs , except for Amendment No 69 which be a correction to Amendment No 41 .	rejection and disappointment
a panel of the 9th US Circuit Court of Appeals uphold California 's assault weapon ban in a 2-1 ruling last December .	uphold California ban on assault weapon
the report that be adopt by the turkish cabinet on 21 September as a reform programme contain several planned amendment to the law , such as the inclusion of measure in the Civil Code that be design to enhance effective equality between man and woman in social and educational field , way to better combat domestic violence by training judge that specialise in family matter and , lastly , measure to prevent people that have commit crime of honour from serve reduce sentence .	the need for criminal ' rehabilitation
it escape I how the Commission can give this estimate as early as February and the Council in July .	unreasonable estimate and untimely council
the show 's tower stand eight story high , with performer attempt to dive into a pool just 9.5 foot deep .	splash in paddle pool
thirdly , when we discuss dossier of this kind , I think it become clear that we do not make the connection between we oil supply , on the one hand , and the fact that we be still use fossil fuel on the other .	the connection between oil and fossil fuel
fan of the artist join he music industry peer in a outpour on social media , honour the New York singer .	fan appreciation
Madam President , the enlargement of the European Union be loom , and the report by the Court of auditor leave we in no doubt that there be still a great deal of work to be do in the candidate country too .	vote booth
despite what have be agree , I sometimes wonder if it be possible to achieve this objective within exist budget constraint without undermine the agricultural budget necessary for a sustainable rural sector in exist Member States .	proprietor and shareholder
naturally there be a need to budget carefully , we support this and should not try to get round it .	be conscientious of the budget
I will discuss that issue with my service once the budget resource for next year be clear .	yet-unclear budget resource
the problem I be mainly concern with be that small enterprise do not always have sufficient guarantee and a proven business track record to offer investor .	credit report
Police state the information lead to the alert be likely a prank , and if so they intend to find and prosecute the responsible party .	police prosecution of prankster
the only pilot who interview seek anonymity .	a pilot 's cap
nobody really know what happen there except for I and the guard , and I can assure you that what he say happen do not happen , Kaye say .	median household income
this information must be make available to the european , state and port authority , and to interested member of the public .	in term of both quality and quantity
SCO say it terminate Sequent 's contract due to improper transfer of the company 's source code and development method into Linux .	claim of proprietary code in the Linux kernel
the swede have not celebrate they national day much at all , compare to e.g. the Norwegians .	low swedish national pride
Mr President , first of all I must say that I welcome this report .	attentiveness to the President
for small tanker , we have adopt a compromise position between the 5000-tonne limit set by the éìï and the 600-tonne limit set by the Commission .	the democratic development of he country
one Member of Parliament use the term ` traceability ' .	a new term use in Parliament
we do not think , as the House know , that it be necessary to make a explicit reference to this in the regulation .	unnecessary reference
I fully understand why people want market organisation for intensive livestock farming , and why they should want to scrap agricultural policy for land-based production .	small and medium-sized business
the Commission and the Member States should see it in this light and use the finding of this report as a tool for improve they performance in manage the EU 's finances .	manage one 's personal finances
Baz Luhrmann 's opulent version of the Puccini opera will fold June 29 after a disappointing seven-month run and loss of about $ 6 million .	the Puccini opera go dark after seven month
Nature protection organisation be also include in cooperation at local level .	local nature protection
he be chief executive of bochk until he be suddenly recall to Beijing last month .	a recall chief executive
Ms. Kethley , who have repeatedly deny any infidelity , have recount a similar story .	testimony before the senate
if we treat the area as a region of political antagonism we shall be make a big mistake .	political antagonism in a area
Health Minister Peter Coleman say about 300 people have be kill and 1,000 injure as the rebel fight into the capital .	wanton destruction and death cause by rebellion
I should like to thank the rapporteur for he report .	the committee chair by Mrs Palacio
Freddie Mac share be down more than 16 per cent at $ 50.18 at midday yesterday .	Freddie Mac share price
with the transfer of eur 175 million we have estimate eur 25 million more than we expect .	poor estimation
BOCHK chief executive Liu Jinbao be transfer abruptly to Beijing last month .	a abrupt transfer of BOCHK CEO Liu Jinbao
the Commission be also require to carry out a huge amount of work in connection with negotiation hold within the framework of regional fishery organisation .	the fight against serious organised crime
Madam President , I have already mention that I have be to sea in the past .	presidential pirate adventure
this mean therefore that the Commission will only deploy the legal aid it have at its disposal within the meaning of the regulation .	the Commission 's intend use of available lawyer
we know that the Commission value ASEM extremely highly and it have we wholehearted support on that score .	full support of the Asia -- Europe meet
the transboundary nature of the marine environment , which mean that pollution in one area can impact on a wider region , lead to the need for a community-wide framework for cooperation in the field of accidental marine pollution .	marine pollution impact
they be free on October 25 after one of the woman report she situation to a non-profit deal with force marriage case .	Non Profit 's fight for freedom from force marriage
I represent some grower and I be thus very concerned indeed .	worried farmer
the Council do not receive a copy of this letter but the Presidency have , of course , reply to Mr Cem and all of the Member States be inform about the content of the reply give .	the President 's response
at present , the effort of myself and my office be focus on limit the effect which the distance between the party and the future tribunal may have .	effort to improve relation between the party and future tribunal
only 66 year old , Brooks be kill on Monday , Aug. 11 , 2003 in a automobile accident in he native Minnesota .	treacherous Minnesotan roadway
the European Union be right to react positively to President Kostunica 's accession to power .	good president
I would like to remind member that , in air safety , the amount of compensation pay in Europe and North America be not equal to the amount pay in other country .	status-enhancing term such as modernisation
the rapporteur ' s proposal aim at harmonisation on a european scale can only be positive .	proposal for harmonization
Mr President , in March this year we adopt the directive on cableway installation design to carry person .	connectivity and cable
I believe that Mr Duff be present this morning when we discuss the european Council in Biarritz .	discuss the european Council
the chain , which have be under new management since late 1999 , have more than 3,400 store and $ 15.8 billion in annual revenue .	nearly sixteen billion in annual revenue
amend the directive in term of greater stringency in its application and the harmonisation of legislation , especially regard the selection of ship for inspection and the scope of the different type of selection be clearly a positive step .	positive movement
it should be note that this right to be different be nothing more than a demonstration of the principle of equality , which also require different treatment for anything that be different .	a recipe require equal part of milk to water
Mr President , I thank the Commissioner for she continue commitment in the field of maritime safety .	application for membership
I be indeed grateful for the support which the Christian-Democrats and , in fact , part of the Liberal Group , have lend to this one specific amendment to curb all aircraft noise .	liberal against aircraft noise
Ferrari driver Felipe Massa for the third consecutive year win from pole the FIA Formula one 2008 Petrol Ofisi turkish Grand Prix at Istanbul race circuit , Istanbul , Turkey .	Iran nuclear deal enter into force
we have sometimes even wonder to what extent the cyclical market crisis itself may not be cause by the speculative action of these business structure , which thus gradually take control of the sector for they own interest .	a brief question for the Commission about Article 4
Canada have just decide to legalize same-sex marriage , and they have high hope that Massachusetts ' high court will take a similar step within a few week .	the vast majority of trade on Eurex US
furthermore , in the communication adopt on 4 October 2000 on the European Union ' s oil supply , the Commission indicate that , at the european Council of Göteborg , it be plan to present a plan to save energy and to promote the diversification of energy source , which should help to boost energy efficiency , especially in building and transport .	energy saving
at least 61 people be kill and dozen injure across Afghanistan yesterday in the worst outbreak of violence for more than a year .	when a bomb explode nearby
the question , Mr President , and I shall end here , be whether there be a solution that would exert greater pressure than that propose by the President in he statement and whether the aid we be go to give will be entirely different from that of the United States , in other word , not intend for crop-spraying , but for crop replacement and also for social , rather than military , purpose .	request to the President for aid for crop replacement and to solve military and social issue
secondly , I would say that it be french law which will have the power to confiscate or freeze the asset of a specific company in order to compensate for damages or anything else , and it could establish liability beyond those lay down accord to the objective criterion provide for in current international legislation on hydrocarbon pollution .	a certain pessimism
First of all , on the procedure for present the annual report to Parliament and the Budgetary Control Committee , I be happy to listen to the assurance from member of Parliament that the situation this year be more satisfactory than before .	by letter it look better
I be sorry to have to tell you that I be not satisfy with you reply .	complicated and difficult
BEA Systems Inc. .beas.o on Thursday say second-quarter profit rise 28 percent , as revenue grow amid a contracting overall market for business software .	statement from its competitor
on the contrary , we must work for a Parliament which campaign for openness , efficiency and effective democratic control of the european institution .	parliamentary control of european institution
he last post be link to a poster of he on a closed door .	door poster
I know that this report and the work that Parliament be about to embark on in the context of the discharge procedure will contribute to greater vigilance when it come to community spending .	monitor oil price
Madam President , Commissioner , lady and gentleman , I be especially keen to be with you today for the debate in the European Parliament on the first maritime package because you be about to examine three important text which be a vital step in a issue which recent event have unfortunately make into headline news .	all key stakeholder
he face a additional 25 year in prison on the federal charge when he be sentence July 7 .	a additional twenty five year in jail from federal charge
Dos Reis be schedule to be sentence in Danbury Superior Court this morning on charge of first-degree manslaughter and second-degree sexual assault .	conviction of 1st-degree manslaughter and 2nd-degree sexual assault
Ryanair have tell pilot anybody sign a `` so-called safety petition '' might be dismiss .	aeroplane food
we believe that in such case the trade should not be burden with manufacturer 's duty under product safety legislation .	health and safety law
police advise resident Friday not to travel alone to convenience store and to be watchful .	on the lookout for the suspect
yesterday in Geneva , Iran and the p5 +1 nation -- the five permanent member of the UN security Council ; United States , United Kingdom , China , France , and Russia ; plus Germany -- reach a six-month deal over Iran 's nuclear enrichment programme .	nuclear enrichment deal
so far , since a interdepartmental group be set up for the outermost region under the presidency of Mr Delors , we have travel a long and fruitful road , and I must express the deepest gratitude of the Europeans from the outermost region to those who have preside over that group .	a long journey yield ripe adventure
it be Parliament which support the Commission 's proposal to create the european Agency for Reconstruction .	support proposal
I should like to remind you that the main priority of the card programme be the strengthening of institution with regard to democracy and the rule of law , economic development and reconstruction , and regional cooperation .	improve the country
he symbolic presence here could open up prospects for the overall policy which we be pursue .	the importance of the Commissioner 's presence
a new installer app be plan to be release in the come week .	app premiere
many of the country affect , like Colombia and Ecuador , be consider critical to the administration 's effort to bring stability to the western Hemisphere .	regional political stability
that be why I support the amendment call for specific step to be take in the field of new technology .	fast move technology
it be worth point out that the principle of the mutual recognition of criminal decision , in accordance with the conclusion of the Tampere European Council , must make it possible to reinforce cooperation between Member States while at the same time reinforce the protection of human rights .	protection of human rights
I believe that the intention as a whole be hugely reassure , but the reality be that meanwhile we dockyard be close down .	the death of the dockyard , despite the best of intention
I beg you indulgence to hear the answer please .	speak audibly
first , on the social and cultural function of digital content , the Commission welcome the fact that Parliament emphasise the social and cultural dimension of digital content .	digital social media
President Bush sign a waiver exempt 22 country because they have sign but not yet ratify immunity agreement .	President Bush sign law
that be the case , the level of funding allocate to Kosovo be not without certain problem .	money lending
he next play , `` will success Spoil Rock Hunter ? ''a satire on Hollywood , last more than a year on Broadway .	the largest US lender for student
in this connection , effort be require to solve the major social problem , for example unemployment .	rapid technological development
that , in principle , be the idea behind Amendment No 36 , although I believe the idea have not be fully develop yet .	the benefit to the 36th amendment from a re-examination
we have be instruct to vigorously prosecute these libel proceedings .	manufacturer 's instruction
Axelrod die of heart failure while asleep at he Los Angeles home , say he daughter , Nina Axelrod .	more than a hour
if anyone need convincing , just look at the evidence .	convince graph
if it be not break , do not fix it , say Senate Minority Leader Tom Daschle , D-S.D. `` I do not see much break . ''	Senate Minority Leader Tom Daschle
I be especially glad that we have be able to safeguard financing for the Socrates , Youth and Culture 2000 programme that be decide at the end of last year .	Finance available for programming
highly versatile , Frost would prove confident at both serious political journalism as well as light entertainment and comedy , host sketch show the Frost Report in the mid-60 .	newspaper editor in the 1960
Mr President , I very much welcome this e-content programme and should like to refer to two aspect of it .	address parliament issue
there must be a clear signal to sub-standard ship that we will not tolerate they in european water or in european port .	humanitarian aid
I do not think he 'll ever totally recover from this .	personal recovery
we declaration of rights be the first of this millennium .	rights movement
Mr President , since the break up of the tanker Erika , a package of measure have be devise , under political pressure , with a view to improve the safety of ship at sea .	improve the safety of ship at sea
the agency have be able to stay open during the government shutdown because it be fund by the Federal Reserve .	government issue
major british charity comic Relief have invest money in arm , alcohol and tobacco firm , accord to a BBC Panorama investigation to be broadcast this evening .	play as striker in Germany 's national football team
other change in the US military uniform be schedule to take place by the end of the year .	U.S. military uniform
moreover the creation of sem provide no solution to the continue mismatch between 8 voluminous administrative resource .	open the system to third country
the opening of the tomb would allow investigator to reconstruct a biological profile of the first king of Portugal , who die 821 year ago .	first Portuguese King to be biologically profile
on the one hand , the largest producer , or those integrate with processing industry downstream , would distance themselves from this measure , prefer the system they already have : individual savings ; bank loan and redistribution fund .	the early part of next year
he family be devastate , and ask for privacy at this difficult time .	family reunion
	the vote will take place tomorrow at 11.30 p.m. tomorrow 's voting
it be therefore up to NATO to take the step it deem necessary to prevent further accident of this kind .	NATO 's response to the accident
but stock have rally sharply over the past 3-1/2 month amid hope for a economic rebound later this year .	hope for a better financial situation
I think you 'll see a lot of job growth in the next two year , say Mankiw .	consistent gdp increase and revitalized manufacturing sector
the most difficult problem in the new budget concern external action .	accurate budgeting
the safeguard clause be currently be work upon and , if Mr Clegg need background argument in order to talk with the sugar beet farmer , I shall make these available to he .	argument between Mr Clegg and sugar beet farmer
some people think that it be possible to create a internal market in Europe without agree on fundamental value and principle .	build internal market with no common ground
indeed this be what have happen in the case of the euro over the year , whether we like it or not .	unchangeable euro eventuality
it be a moderate proposal , for Scandinavia already have stricter standard in place than those propose for the year 2012 .	strict rule in foreign country
Bombardier and Embraer will each deliver 85 jet by September 2006 , U.S. Airways say in a release .	the delivery of eighty five jet from Bombardier and Embraer
Mr President , lady and gentleman , we recently reach a agreement with the Court of auditor under which we would be able to obtain advance information from the Court 's annual report on a totally confidential basis , and we also agree that we would be discreet about this .	legal secrecy
April of this year be the next highest month with 493 complaint , edge out May of last year with 488 complaint .	Easter complaint
more than 80 % of accident be associate with human error , but there be reason for human error , which be social in nature .	accident due to human error
when it be relevant , from the audit point of view , we mention everything that have to be mention .	auditing encompass the unmentionable
face with the disastrous and anarchic situation in maritime transport , Europe have take up the challenge and , just 11 month after the loss of the Erika , will be in a position to announce that never have a procedure be work out quite as quickly .	Europe 's modernization and improvement of maritime transport
I have no doubt but that the proposal which the Commission will submit to the Council will be characterise by these quality .	wedding bell
I really do think that what the rapporteur have do here be a brilliant achievement ; it show just what you can do with administration when you set you sight on a specific objective and the objective be clearly specify here .	a sufficient level of flexibility with regard to the basic rule
