what would be my best bet to survive a raptor attack ?	flee for my life or fighting
when will lockerz launch come and what will it be like ?	prize back in stock
do anybody know of any web site that have a list of all the flower they have ?	list of all flower available on a website
be there a website where I can create a creature ?	creative design website
what be the best free , ONLINE video converter that actually work ?	online streaming
do anyone know a untie filter that work on Mozilla firefox3 .6 ?	untie filter browser plugin
how to take snapshot of you and the person you talk to on skype ?	Amazon Free Super Shipping
how do I make a new tab in Firefox NOT open as my last tab ?	Firefox tab preference
what be a Proxy and how do I get rid of it ?	little known site
I cant send mail from my alternative address to any Yahoo address ?	block email address
on Twitter if u reply to a tweet post by sum1 u follow do u they see ur reply if they be not follow u ?	without the file actually be on my computer
why do Verizon dsl not offer promotional discount to current customer ?	Verizon promotional discount
can you pay for stuff on ebay with mutiple card ?	credit card payment online
be www.listia.com a scam , or do you really get the stuff you win ?	take forever to load
how do I get my once a year free credit report ?	interest rate base on my credit score
how long do it take to receive a payment to Paypal account when sell on Ebay ?	contact the buyer for proof of payment
look for Advice about a eBayer Seller , send I empty box .?	advice on empty box send by eBay seller
if i give points2shop my addre will they send I stuff i do not ask for ?	only the cookie you want
how to block audio on commercial on a webpage ?	mute sound
computer show that internet be work but get dns failure on every website I try ?	constant dn failure
how do I watch video on megavideo without the time limit ?	watch video on Megavideo
do prize on lockerz decrease point over time or do they stay the same ?	lockerz prize point value
can we print deviantart pic on a printer if it be not a pay picture ?	print non-paying deviantart picture
how to remove this error that be skype ie plugin error ?	configure the skype ie plugin
suggest I a good wireless internet connection with unlimited usage ?	unlimited wireless internet provider
when you submit a best offer on Ebay do it count as a buy it now purchase ?	wait for purchase to complete
my twitter search tool work with ie but not with Firefox ?	Twitter search tool
only this year , six year overdue , and under enormous pressure from the french government , have the Commission at last proposed european harmonised noise indicator .	european harmonised noise indicator
I believe the future of fishing in international water depend on these organisation , and the Commission must make every possible effort .	the future of fishing in international water depend on organisation
the Commission consider that such adjustment go in the right direction towards the establishment of fairer charge system which give also a incentive for a more rational and efficient use of the road network .	on the back of the taxpayer
I be commit to ensure that the food consumer have available , whether it come from within or outside the European Union , meet the highest standard .	a thorny issue
if the financial perspective be not revise , we will inevitably be catch up in `` financial engineering '' , in redeploy resource and in cut , either in general expenditure , social and environmental spending or in cooperation .	preventative measure
I will , of course , inform the President of what you have say .	espionage within government
we now have a harmonised scheme to draft country strategy papers and indicative cooperation programme in all develop country .	a brisk pace
current compensation fund have be inadequately fund and this be all too apparent in the case of the Braer disaster where the Shetland Islands fishing industry be inadequately compensate for its loss .	inadequate funding after the Braer disaster
in paragraph 26 , moreover , it call for the establishment of a international arbitration organisation to cancel the debt of the country of the South .	document state the necessity of international arbitration organisation to eliminate debt in the South
we have hear the justification for they and for the reprise of the industrial argument which we hear in committee .	call for jury
it be also unfortunate that a large number of programme have be put in the so-called performance reserve .	performance reserve
I be sure that the albanian political prisoner will also be release soon .	a considerable number of albanian
pressure also come last night from religious circle as three anglican bishop say it be time for they former colleague to step down .	pressure from three anglican bishop to abdicate
I believe that some rethink will certainly have to be do between the Council and Parliament on the liability limit for classification society , irrespective of what be decide today .	rethink liability limit
at the very long end , the 30-year bond us30yt = rr lose 2/32 for a yield of 4.41 percent .	raise its target for chip sale on Friday
Mr President , I have Mr Nicholson 's problem in a even more acute form .	in the political sector
the american anglican Council , which represent episcopalian conservative , say it will seek authorization to create a separate group in North America .	battle over gay rights
that be why I believe there be a tremendous role for the Commission to play in go out there and encourage the fisherman to come forward and cooperate with it and come forward with a solution that we can all agree to .	the commission 's cooperation and support for a agreement with the fisherman
IBM of the US and Infineon Technologies of Germany will today announce a technological development that could threaten multi-billion dollar memory chip market .	a tech advancement from IBM and Infineon
Parliament must be regularly consult and update on progress , and it be this , the second of the rapporteur ' request , which we must all support .	progress consultation
for example , with regard to we aid to mediterranean country , we have a backlog which have accumulate over many year of budget .	hot country with bad budgeting
what do you think the impact will be for the Paralympic movement will be with the Games be televise live in the United States for first time ?	implication of broadcast Paralympic game in USA on Paralympic movement .
I think it be a excellent political declaration but we still have a few problem here .	solid political allegation with trouble
Mr. Holden tour Northmoor , where between 25 and 30 home be either damage or destroy and the town hall and police station also be damage .	damage to dozen of home as well as the police station and town hall
how can we even consider revive this partnership without first resolve the conflict ?	relationship break-up
as regard MEDA , the Council say that the commitment be not a problem owe to the eight year of payment backlog .	equate owing money with debt
the important thing now be that a good number of project be present under the spd , but also , alongside this grass-roots action , we must consider in depth the specific need of each of the outermost region in relation to access to the information society .	grass-roots movement in rural America
the new service be plan to be introduce on flight connect Honolulu with Oakland , San Jose , Sacramento , Seattle , Phoenix , Fukuoka , sendaus , Seoul , Brisbane , Papeete , and Pago Pago ; and Kahului with San Jose , Oakland , and Seattle .	national and international flight
as Commissioner Schreyer have already mention , there be many political announcement come out of this year ' s budget : the reorganisation of agricultural policy , new structural programme , measure to ensure better implementation of the structural policy , and step design to follow up the decision take at the Lisbon Summit for create a stronger and more competitive EU and for combate social exclusion .	a obstruction to the proper running of the market
this show that , in this area more than any other , we have a tremendous responsibility and we must , it seem to I , stifle any institutional pride we may have .	put aside institutional pride
provide the vendor can always inform the buyer of the nature of the goods and the limitation on the information that should be sufficient .	false advertising
Branson say that he preference would be to operate a fully commercial service on route to New York , Barbados and Dubai .	federal office
the Fox Movie Channel have ban Charlie Chan .	ban actor from appear
I reliably receive reminder when my dog need a vaccination , write Steinberg , of Johns Hopkins University .	vaccinate the family pet
I would also like to pick on the Council by ask why it be not move forward on Article 24 of the Financial regulation .	online banking
immigrant to the United States from Southeast Asia and India have higher than expect male to female birth ratio , which the report author suggest be partially deliberate sex selection base on cultural attitude from home country .	birth rate in the U.S.
this bring I to we group ' s strategy , because at the core of we belief be the wish to get value for money for the european citizen .	fail strategy for maintain the value of the euro in this crisis
and what be he opinion of Mr Cem 's position - the President-in-Office do not reply here - that there can be no link-up between the Cyprus question and further the Accession Partnership between Turkey and the European Union ?	the President neglect to answer a question
some amendment , such as no 1 and 18 , deal with question that basically concern the United Kingdom , and it must be say that all the group from the United Kingdom , whether socialist , popular or green , have support they vehemently and they have be approve in the Committee on the environment .	Socialist , Popular and Green common viewpoint .
the Court , as in other year , have fail to point out exactly where those failure occur .	successful management of the EU 's finances
the question be : who should these student apply to in order to confirm that , if they take these course and complete they study in Britain , they be entitle to have result ?	british student confirm that they degree will yield result
the website of international news service Al Jazeera be hack Tuesday by a group idenitify only as Al-Rashedon .	trapping four people
Bank of America lead Consumer Financial Protection Bureau complaint about mortgage .	rise mortgage
I never think I would say this , but I almost miss Vin Diesel at first .	Vin Diesel 's movie character
the event feature brand new attraction include a high dive show , a wolf pack exhibit and a old West exhibit .	howl wolf on show
it be the prerogative of those hand out money to stipulate the political objective and the Commissioner have do so on several occasion .	the Commissioner 's role in distribute money to stipulate political objective
on the other hand , we have the communication network which need a constant supply of content in order to fill they web page and which see nothing wrong in subordinate the content , in ransom it and use it without pay any particular attention to the rule of production .	fill web page with content
Budget policy need to instil public confidence in european policy .	public confidence
you will be aware that this be a deliberate decision take in Amsterdam to clearly distinguish the two role , with the high Representative , as oppose to the Commission , not speak from a completely independent viewpoint , but under a remit to coordinate the common foreign and security policy that lie within the competence of the Member States , and there we should leave perhaps ample scope for a intergovernmental approach .	a intergovernmental approach toward the common foreign and security policy within the Member States
Charlie Chan be off the case for the Fox Movie Channel .	Fox movie channel
the election in Yugoslavia have show two thing : that the people have finally have enough of the dictator Milosevic and that they have confidence in Professor Kostunica .	make access to support and information
at the same time , the Union continue to provide substantial material aid to both country through its various programme , in particular its TACIS programme .	union collaboration
I too would like to welcome Mr Prodi ' s forceful and meaningful intervention .	Prodi ' s welcome intervention
this may also enable the Council Presidency to have discussion with the Member States with a view to obtain the Council ' s approval of you proposal and to adopt the text at first reading , if necessary by qualify majority voting .	conversion from fossil fuel
provision for social , cultural and charitable cause must be include in Article 87 so that the future of these important institution can also be permanently safeguard .	protection and appreciation of social , cultural and charitable cause
instead of pursue the most imminent and real threat - international terrorist - this Bush administration have choose to settle old score , Graham say .	international terrorist , the most pressing and valid security threat
this initiative be base upon a Council regulation amend the regulation which define the current gsp .	amend current gsp regulation
Mr President , Commissioner , lady and gentleman , let I begin straight away by say that , in principle , I welcome the Commission 's proposal to set up a compensation fund , even from the point of view of austrian agriculture .	many meeting with Russia at all level
the action reflect we strong forward momentum as we intensify we business focus and work to achieve profitability , '' say Katsumi Ihara , president of Sony Ericsson .retailer J.C. Penney Co. .	Inc. and Walgreen Co. .
the extra EU subsidy propose in Mr Garot ' s report would , in my view , be quite unreasonable in a year such as this when , with Agenda 2000 and the forthcoming enlargement to include Central and Eastern Europe , we be to reform agricultural policy .	a independent commission of inquiry
Commissioner , lady and gentleman , these be the solution advocate by the Committee on Agriculture and Rural Development .	the compromise amendment
but we will have a chance to go through all that .	untangled time
Ladies and gentleman , as I be sure you will have notice , the last part of the speech by the President of the Court of auditor be mar by a unfortunate bug that intrude between he speech and this Chamber .	unlucky insect get squashed
both Estrada and Honasan have deny any involvement in the fail military rebellion .	claim dozen of life
perhaps some European Union common sense will help sort out the problem and give George Bush he rightful place in history - its dustbin !	basketball court
the port state control Directive be design to check compliance with international requirement and not to introduce new rule .	compliance with requirement
this swift and focus approach result in the two ` erika ' package and six proposal have create a enormous momentum .	no access to learn
by act in this way in the name of subsidiarity , the Union be , in actual fact , shirk one of its responsibility , as it have in recent week both in northern Italy and in Spain .	the behaviour result in irresponsibility with appurtenance
the Commission would first and foremost like to highlight the commitment we make to the citizen of Europe to ensure protection of the personal datum process by the institution of Europe .	internal reform
the fact be , even though , as early as the Treaty of Rome , reference be make to the french overseas department , we have to wait until 1989 and the programme of option specific to the remote and insular nature of these region , the notorious poseus programme , for the European Union to at long last acknowledge that the permanence and combination of structural handicap affect the outermost region justified special treatment in comparison with the other region of the community .	spa treatment include massage and facial cleanse procedure
a amendment to remove such protection fail by a vote of 186 to 237 .	failure in remove protection
we be work on these in committee , but no decision be take on the matter this week , as Poul Nielson be absent on a visit to the Balkans .	the committee 's indecisiveness
in measurable term , the liberal rationale be effectively oppose to a high level of maritime safety .	irrational sea nature and logical safety precaution
the Duke of Edinburgh miss numerous royal occasion while he be in the private building .	Justice Minister Tzipi Livni note on Saudi Arabia
why do the US media provide so little coverage of the Paralympics compare to other sport ?	US media 's lack of paralympic coverage
I should like to reiterate that the urgent action upon which you be now insist be not necessary .	unnecessary action
we 'll be able to work on so many cool thing .	a fun job
before that the division be know as the NASCAR Grand National Series .	the oath of office ceremony
iraqi official here insist that the attack be be carry out by `` outsider '' who slip into Fallujah and attack at night .	attack on Fallujah market and people
in its report adopt on 15 November the Commission conclude that operate aid under regulation 1540/98 have not provide a solution to the problem of south korean pricing practice .	no solution to South Korea 's trouble of pricing practice
Ramiro Zapata be the latest of 25 human rights activist to be murder and , recently , the colombian press condemn the paramilitary group ' `` Plan 100 '' to kill one hundred human rights activist .	the condemnation of colombian paramilitary group ' `` Plan 100 '' to kill one hundred human rights activist
both this food authority and the legislative proposal be propose , which aim to guarantee food safety , will receive the support of this House , Commissioner .	poor condition in sweat shop
this can also be regard as a competition-related issue , as duty-free goods can continue to be sell in the southern part of the Baltic on the cross between Stockholm and Helsinki , whereas they be not permit to be sell on the journey between Umeå and Vasa .	regulation on the sale of duty-free goods around the Baltic Sea
nobody will believe a word he say .	no credibility
a black box , a blacklist : we be in complete agreement with all these thing , but there be still a few point I would like to bring to you attention .	forbid list
the responsible clarify that the investigation will be authorize as soon that `` all formality be fulfil '' .	investigation pend on formal document
airport such as Orly , Schiphol and Barcelona already meet strict requirement .	airport delay
it be a gravity dam , which hold back the water through sheer mass .	rise in the price of black tea
the point that the honourable Member make be a important one .	its institutional structure and policy
Jeter , who dislocate he left shoulder in a collision March 31 , take batting practice on the field for the first time Monday .	the first time in batting practice since the injury
	in 2002 , Forbes magazine estimate Clancy 's earnings at us$ 47.8 m. Forbes magazine 's estimation of Clancy 's income
it should thus promote the setting-up of new regional organisation , begin where the Community already have a presence , such as in the western Pacific and south Pacific .	community expansion of new regional organisation
leader agree to a expand and update asia-europe cooperation framework 2000 which form the work programme for the come decade .	asia-europe framework expansion
-lrb- since more than 12 member of Parliament stand up , the oral amendment be not retain -rrb- .	Parliament voting
Mrs Chairman , a series of high-profile ship disaster , particularly involve oil tanker , have hit we continent in the recent past .	ship accident
Prince Philip , who be aged 92 , be hospitalise on June 6 to be give exploratory surgery on he abdomen .	the international risk of global warming
I should also like to add that these two text focus , in particular , on strengthen the framework of criminal law in order to fight organised ring of facilitator .	organised crime
it must be remember that the fishery agreement with Morocco be much more than a simple fishery agreement ; as he know , if this agreement be not reach , bear in mind its significance , this fact might conceal a deterioration in the relation between the European Union and Morocco .	fishery agreement between the EU and Morocco
as part of peace talk between Israel and the Palestinian National Authority , Israel release on Tuesday early in the morning 26 palestinian prisoner imprison before the 1994 Oslo accord for murder or attempt murder of Israelis .	skiing business
Tartan Day be designate as a holiday by the US Senate , `` National Tartan Day '' , in 1998 .	US Senate 's `` National Tartan Day '' holiday est. 1998
in the undergraduate case , Rehnquist say the use of race be not `` narrowly tailor '' to achieve the university 's assert interest in diversity .	fear about a further softening of the market .
but a state judge have rule that the so-called `` double jeopardy '' protection do not apply in the case .	inapplicability of double-jeopardy provision
I think that remind we in Europe of the important role that we have in Asia , not just in economic and trade term , though it have to be say that one of the reason for Asia 's recovery have be that we have keep we word to keep we market open to asian export over the last two year .	market trade between continent
the head of government have also confirm the Union 's determination to back this process with technical and economic assistance .	support within economics
just across a river , St. Joseph have trendy restaurant , boutique , office and a picturesque beachfront .	all four page of the Constitution
he want the Presidency to outline the way forward at Nice .	important person control Nice
the question raise therefore provide the presidency-in-office with a opportunity to clarify several point .	the White House
we be not look for scapegoat , either in we institution or in we Member States .	delicious Goat cheese
that be why , in my opinion , the amendment table by Mr Bernd Lange be so important .	the importance of Mr Bernd Lange
in Europe , France 's cac-40 rise 0.6 percent , Britain 's ftse 100 slip 0.02 percent and Germany 's DAX index advance 0.8 percent .	rise stock price
in the same vein , at the time of the vote on the resolution on the embargo as part of the Third Commission of the General Assembly of the United Nations which meet on 9 November 2000 , we launch a appeal to the cuban authority to cooperate fully with international organisation defend human rights .	a campaign for the international defense of human rights
could be interpret as a sign that Britain be not interested in create a better world .	Britain 's disinterest in a better world
at Bletchley Park , Turing have work on break the enigma code use by the Nazis during World War II .	Ossie Ardiles 's car accident in Falkland Islands
one of Scotland 's national treasure , William Wallace 's sword , leave Scotland for the first time in 700 year .	scottish sword , a national treasure
a year or two later , 259 , or 10 per cent , of the youth report that they have start to smoke , or have take just a few puff .	mild tobacco use by youth
further to the comment which Danielle Auroi make just now on the subject of the country of the South , I would add that there be some expert estimate which provide some interesting figure , for instance , a range between USD 50 and 250 billion , which could be recover by a tobin-type tax , whereas , at the same time , the UNDP -lsb- United Nations Development Programme -rsb- amount to USD 40 billion per annum , which would be sufficient to guarantee minimum living condition for the hundred of million of deprive people in the country of the third world .	tax revenue cover third world live cost
along with the name change , the airline have redesign its website , and change the name of each of its class of service .	new website , new classification
however , we ought not to focus on Kosovo alone .	focus on Kosovo
I can simply point out the fact that France and Germany - and here I be no longer speak as President-in-Office of the Council - raise these question during a bilateral summit in Vittel last week , where it be decide to form a work group in order to find a solution to the problem .	EU co-operation
the australian team , know as the Steelers , be rank second in the world .	the Steelers ' # 2 worldwide team ranking
we have a common organisation of the market in pigmeat and we should not make the mistake of question the present common organisation of the market in pigmeat which , basically , work .	the lack of good will
give the importance of fishery to the outermost region , I can only be sadden by this .	the 3 little fish , a big hit 1950s song
the NATO war destroy too much and leave too much suffering in its wake .	gigantic finance pump
hundred of thousand of Iranians reportedly watch coverage of the negotiation through the iranian night .	negotiation coverage
this strategy have already be introduce by Joan Colom i Naval , the Vice-President for building .	increase opportunity to act
right now , Madam President , I should like to stop talk and wait for someone from the Council to come here .	continue conversation with the president
I be concern about the possibility of a general failure of numerous machine and rule which would then call the decision of the House into question .	unprecedented success in government initiative
next week , a meeting of the european conference will take place on my invitation in France , in other word a meeting with the candidate country .	meeting of the european conference
