the oldest department store be Trimingham 's , which have a comprehensive range of designer goods such as perfume and clothing , but other store act as exclusive agent for certain producer -lrb- for example , Bluck 's and Cooper 's specialize in china and crystal -rrb- .	a assortment of designer goods sell by Trimingham 's department store
the finer the thread , and the more complex the pattern , the more expensive the piece .	silk manufacturing technique
the main entrance to the circular old town , near the harbor , be the 19th-century Arco da Vila , a charming arch and bell tower habitually crown by a venerable family of nesting stork .	stork make they nest in a picturesque bell tower and arch
Herring Cove give you a good view and detailed explanation of the tide .	100 % operate by tidal power
each spring , provide that weather condition be favorable , it become a home to flamingo .	a spring home to flamingo in good weather
he choose he oak and walnut from North America , teak from Asia , paneling , marble , and glass from Europe .	different building material from all over the world
in summer month there be sightseeing launch and , for the brave , swim .	swim in the summer month
Beijing 's grandest modern shopping mall be Sun Dong a Plaza .	both modern and classic chinese goods
surround the marina be numerous boutique , restaurant , and travel agency , plus all type of service to accommodate arrive cruiser .	perennial spirit of celebration
across the western tip of Bali , mangrove swamp surround Gillimanuk , not much more than one wide street , a few homestay , and the ferry terminal for Java .	the all-encompassing mangrove swamp all over Bali 's western coast
a island of wonderful sandy beach and farmland , it be also home to a large US military reserve .	wonderful sandy island beach
you be sure to find you own favorite , but here be a few acknowledge highlight .	a clear tidal lake
the heart of the city be Plaza Major -lrb- also know by a variety of name such as Plaza des Armas , Plaza principal , Plaza de la Independencia , and Plaza de la Revolucion -rrb- .	Revolution Plaza , also know locally as Plaza Major
a nice excursion from Tavira be to the nearby island Ilha de Tavira , where there be a huge and thoroughly appealing beach back by sand dune .	sand dune lead to a giant ocean beach
it can not be see fully until you enter its precinct through a narrow passage from the street .	a narrow alley from the main street
after a second dutch landing at Padangbai Bay , the puputan ritual be repeat when the Raja of Karangasem and he family throw themselves on the enemy gun .	the puputan ritual of self-sacrifice , as demonstrate by the Raja of Karangasem and he family
nearby , the `` Peak that Flew from Afar '' -lrb- Feilaifeng -rrb- shelter 380 Buddhist stone carving create during the Yuan Dynasty and four sacred cave .	victory against they at Nándorfehérvár -lrb- now Belgrade -rrb- in 1456
here on the night of 18 April , 1775 , sexton Robert Newman climb the tower and hang the two lantern -lrb- `` one , if by land , and two , if by sea '' -rrb- warn the colonist in Concord of British troop movement .	classical americana form the basis for a rich legend of Paul Revere
in Ontario and Québec , where encroach forest gradually disperse the herd of caribou , the Iroquois oust the Algonquin and settle down to cultivate maize , bean , and squash , live in rectangular , multifamily longhouse .	cultivation crop and live in house
many provincial town and village hold Sunday market where haggle be , of course , all part of the fun .	Sunday market
the Film Museum in Vondelpark also have special showing and film festival .	film festival and special movie showing
the spanish Aero cable car give you a bird 's - eye view of the Niagara Whirlpool rapid .	a aerial look on the rapid
it be think that large wooden door be fit between the pillar and that these could be remove to create a stoa -lrb- open fronted arcade -rrb- if the King wish it .	removable , large wooden door
do look beyond the tempting shop front to really get the most out of you tour .	shopping while on vacation
take the cable car across the gorge for a close-up view of the rapid .	a close-up view of the rapid
it cover 21⁄2 hectare -lrb- 6 acre -rrb- , and various collection be house in the old brick military building , most of which date from the victorian era .	the armory in the southwest corner
William Charles Cole Claiborne be a protestant from Virginia who need interpreter to communicate in both french and spanish .	those who follow radical Pedro Albizu Campos
the war of 1812 be foster by accumulate american grievance .	the War of 1812
the hall of benevolent longevity -lrb- Renshou Dian -rrb- be where Empress Dowager Cixi receive court member from she Dragon Throne -lrb- which be still in place -rrb- .	the centuries-old dragon throne
there be also a room dedicate to the family who settle in Cozumel in the 19th century -- after the war of the Castes -- and who have develop the island since that time .	the development and revitalization of Cozumel in the 1800
it be a easy day trip from Acapulco to this famed silver-mining town , and worthwhile for anyone interested in experience more of this country 's historical past .	Mexico 's mining history
the center of Lisbon be small , compact , and easy to get around in just a few day .	the site of Portugal
you 'll also find lot of older piece -- not quite antique but still exquisite -- in collectible shop around the town in the form of pretty spoon , ornate pill and snuff box , or letter opener .	older collectable item like spoon , letter opener , and pill box
each member would organize a fortnightly banquet of game and fish he have catch himself .	seat arrangement for the banquet
Venizelos be in power during the epic population exchange with Turkey -lrb- 1922 -rrb- , under which almost one million repatriate Greeks flood Athens .	immigration from Turkey to Athens
this guard tower , build in 1345 , be decorate in Buddhist carving , with inscription in chinese , Tibetan , Sanskrit , and language of the northern tribe .	a exquisite old moorish village with a sturdy ruin castle
have at least a drink at the keltic Lodge hotel , a old Nova Scotia landmark worth a visit for its view of Cape Smokey .	the historic keltic Lodge and its view of Cape Smokey
remnant of a underwater plateau that collapse in the jurassic period , they be part of a geological formation at least 150 million year old .	million year old remains of a underwater plateau from the jurassic age
the Sierra Morena this nearly 480 km -lrb- 300-mile -rrb- mountain range run from the mountain of southern Portugal in the west to the border of the Provincia de Murcia in the east , effectively form the border between Andalucía and most of the rest of Spain .	in the center of a stairway
in summertime the garrison come to life with the change of the guard -lrb- 10am daily , June 24 -- first week of Sept. -rrb- .	a year-long tour of duty in London
creep plant now climb the sheer wall , provide a new home to numerous bird , lizard , and frog .	the exception that prove the rule
the National Theater be locate here , and across the road be the Estação do Rossio -lrb- with train to Sintra and other place -rrb- , which look something like a moorish palace with horseshoe arch , just west of the square .	the Moor design style of horseshoe arch
here be the true pulse of Budapest : large hotel , museum , government building , shop street , nightlife , and thunderously busy boulevard .	the many activity and attraction in Budapest
when there be rebaixa , or sale happen , wade through the crowd here be no easy task .	impenetrable shopping crowd
just a little way north of the palace site be the chrysólakkas or ` pit of gold , ' where the ` golden bee ' pendant be discover among a greater cache of jewel .	the earliest settler from a previous church in England
the main house date from the 17th century and have be own by the present family since 1864 .	a family-owned house for century , date back to the 17th century
you 'll be able to buy everything from fruit and vegetable to textile .	availability of fruit for purchase
thanks to the well , Turpan grow cotton , melon , and grape of great sweetness and renown .	cotton , melon and grape farming in Turpan
a sacbé link the palace to other part of the site .	royal garden
lure by the promise of treasure galleon and store of ammunition , some pirate work independently ; other , however , be employ by the various european crown , particularly the british , to help carry on they power struggle in the colonial world .	the allure of treasure and ammo for pirate
the side street hold some good art -lrb- and craft -rrb- gallery and plenty of reward for exploration .	explore small side street
the silhouette of Gunung Merapi , still a active volcano , be often visible in the mist across the water .	morning mist across the lake
building inlcude m peus 's Weisner Building , Green , Dreyfus and Landau building , and Eduardo Catalano 's Stratton Student Center .	behind the athletic center
a vibrant café-restaurant comprise one side of the square , but the dominant building be the splendid Vigadó theatre .	the magnificent Vigadó theater building
to the north of Alexanderplatz , behind the Volksbühne theater , Schönhauser Allee be one of the most characteristic avenue of Old Berlin lead to the center of Prenzlauer Berg , the 19th century working-class quarter -- now a lively , bohemian area with colorful nightlife .	Berlin 's laborer housing
Northeast of Stadhiou be panepistimiou -lrb- University Street -rrb- , officially name Elefthería Venizélou after the Cretan statesman .	designer of the Cretan constitution
walk through the loggia to find the Church of Ágios Títos .	the nation 's main north-south railway
you do not need to travel all the way to Herend to buy Herend ceramic , as there be a specialist shop on József Nádor tér -lrb- behind the Gerbeaud café on Vörösmarty tér -rrb- .	the shop of József Nádor tér for buy herend ceramic
from 1950 , a promotion campaign under Sir Stafford Sands be hugely successful in attract tourist to the Bahamas .	the center of activity along this beach hinterland
there be numerous excursion to Santorini to the north , and this tiny rock in the Aegean make a interesting contrast to its larger cousin .	the most beautiful greek isle
the battlements afford good view over the harbor , and there be craft shop upstairs .	the gift shop in the basement
bar , restaurant , and late-night brasserie line the adjoining rue Berger and the street lead off it .	business just off Berger street
try to visit before noon or after 4pm , especially in summer as most farming activity stop in the heat of the afternoon .	the precious image of Cristo de la Viña -lrb- Christ of the Vineyard -rrb-
the Bagatelle , once a royal retreat , have a very lovely English garden , burst with flower during spring and early summer .	in Europe and North Africa
the trail be especially good during early spring or summer morning , when the water be perfectly still , capture the most breathtaking color from the tree and the cliff of Mount Watkins behind it .	the giant of the flea market be St-Ouen just north of Porte de Clignancourt métro station
however , if you have the time it be much more rewarding to do the circular journey along the north coast to Sitía then south around the Sitía and Ornón Mountain range approach Ierápetra from the east -- the landscape be much more exciting .	strike a 17th-century copper bell with coin
a legend arise that the cross may have be leave by a ancient saint -- perhaps even the Apostle Thomas -- some fifteen century earlier .	a centuries-old ancient cross
just past here be Puente Diamante , the Acapulco Princess Golf Club , and a row of luxury hotel that front the open Pacific Ocean .	bury in coffin within coffin in subterranean royal tomb
a compact straw and vegetable market sit at the main crossroads .	business at the intersection
though no one be really sure of the precise landing site -lrb- columbus be renown for have be less than accurate in document he landing site -rrb- , the small park with its column and naïve painting depict spanish colonization serve its purpose well .	a quaint park with painting of the spanish arrival and colonisation
two popular stop be La Coca Falls , on the right after the 5-mile -lrb- 8-km -rrb- point , and the Yokahú Observation Tower , at the 51⁄2 - mile -lrb- 9-km -rrb- point .	La Coca Falls and the Yokahú Observation Tower
but Britain back this vested interest with tough diplomacy and a powerful navy , while Louis XIV be too wrap up in he european power play to pay much attention to French Canada .	Britain 's vested interest in french Canada
in the fourth century , the first christian church , St-Etienne , be build , join two century later by a second church , dedicate to Notre-Dame .	the church of Notre-Dame
when Adolf Hitler arrive in Paris as a conqueror in 1940 , the Arc de Triomphe be the first place he want to see .	distaste for the Eiffel tower
cistercian monk protest that such a sumptuous structure be a insult to the godly virtue of poverty , and today , architectural purist still find Notre-Dame a bit `` too much .	religious order
I mop up the kitchen floor so it be spick-and-span .	friend in high place
John Major be describe by he opponent as a dyed-in-the-wool conservative .	attack from liberal politician
mother and father learn to drive in a car with a 3-on-the-tree .	manual transmission automobile
what kind of a harebrained , off-the-wall idea be that ?	proposal for action
he give a tongue-in-cheek explanation of why the sky be blue , offer a theory about some primordial discount on light blue paint .	playfully explain science
my effort lately have be catch-as-catch-can , not carefully plan .	work out for the best
the broken window and overturn plant pot be a tip-off that something be wrong .	hint of a break-in
we be work at cross-purposes here , if you be try to reduce the count and I be try to increase it .	conflict increase and decrease
not want to reveal where she get the gift , he mother have to stretch the truth a bit .	a present hide in the closet
he be a nose-picker .	a uncouth young man
the head-in-the-sand approach to environmentalism seldom improve matter .	ignore the problem
when the fire alarm go off , it be a free-for-all .	total chaos due to the fire alarm
24 hour of tv coverage of the US election verge on overkill .	incessant coverage of the election
the police receive a tip-off about a recent bank robbery .	clue about who be responsible for a robbery
after hour of mind-numbing work sort hundred of nearly identical form , he need to stop and do something else .	office paper work
it be like whack-a-mole : as soon as you fix one , another appear .	a constant stream of new problem
she be very popular and good with number , so I expect she 'll be a shoo-in for treasurer .	well-liked and financially savvy
it be really a toss-up between the red skirt with blue stripe and the blue skirt with red stripe .	a tough decision on which skirt to choose
when I see that weird house , I get the heebie-jeeby .	shiver down my spine from see that spooky house
a head-on approach to a problem .	pussyfoot around the problem
the oppose team be so soundly trounce , they leave directly from the game with they tail between they leg and avoid the locker room entirely .	avoid further humiliation by immediately depart for home
the story describe the main character 's wristwatch in mind-numbing detail .	second hand on the watch
we completely agree and there be no daylight between we on the issue .	complete agreement
he have a ankle sprain and he status be day-to-day .	increase to sports-related injury
Madrid have to keep a eye on they loose canon after the game to avoid any further penality from player fight .	player who be inclined towards violence
now , over to we man in Tokyo for a on-the-spot report .	japanese news update
he give a blow-by-blow account of the entire trip .	recollection of event
do some back-of-the-envelope calculation before all the fact come in .	wait for final detail
they soup-to-nuts approach leave we with few question .	question about design
one of the most upper-crust district of Paris .	step out of line
my wife make the best little old apple pie in Texas .	hammer home
he take she to the park where they first meet before pop the question .	engagement ring
Pretty eye have always be a turn-on .	attractive eye
although they be still available , I think we would be hard-pressed to find one on short notice .	brick and mortar
he never get use to the cut-and-thrust of political debate .	objective political discussion
he tell a off-color joke .	a crick in my back all night
he be more of a lone wolf , always program on he own and rarely talk to other about what he be up to .	software development by a single individual
she tell I to ask so-and-so , but he do not know , either .	ask a specific person
Tom Pitella be a go-getter and do not rely on other to prove thing in the field of mathematics to he .	solve mathematics problem himself
the government contract force we to stick to hard-and-fast rule .	penalty for violate export control
the ` closet can be a scary place for a gay teenager .	hide one 's sexuality
they be aim for a more upper-crust clientele .	whale of a time
this be not you run-of-the-mill refrigerator ; you 'll find the extra feature well worth the price .	high and dry
I be make a cake but when I add too much sugar , it become the balls-up of my cooking career .	the worst cooking mistake I have make
the streaker 's wet dream be to be on tv butt-naked on a rainy day .	personal best-case scenario
he make a few off-the-cuff remark before launch into he prepared speech .	precipitated into a riot
obtain financing be a life-or-death matter for the research .	labour of love
the term black sanctus be originally anglicize from Latin .	the Latin vulgate
my slave-driving boss expect I to work over the weekend - what a ball-breaker !	unappealing work on the weekend
for we it be be a real catch-22 ; when we have the time to take a vacation , we do not have enough money and when we have enough money , we do not have the time .	the time and money require for vacation
no wonder it do not work .the whole design be ass-backwards .	design by committee
the politician be unnerved by the journalist 's quick-fire question .	a break report by 60 Minutes
Congress frequently meet behind closed door to avoid public scrutiny of they bargaining process .	congress dodge criticism use secret meeting
he send flower in a last-ditch effort to keep she from leave .	flower for a love one
he touch-and-go condition keep he wife at the hospital for day .	precarious health
he prefer the clarity of science and leave the touchy-feely stuff to other .	attraction to cognitive science research
he be be on he soapbox all day about the new football coach .	complain about the coach
the earthquake leave the resident hard-pressed .	beyond one 's wildest dream
I hate this poor , polluted , ignorant pissass town !	power behind the throne
that pencil-necked geek be not go to stop I .	eye in the back of you head
the media publish a blow-by-blow of the trial as it happen .	extremely detailed court reporting
they catch we flat-footed .	fiddle while Rome burn
we be doom if this wee jumped-up monkey get Gordon Smith 's blessing .	bad planning
she be rather thin-skinned when it come to comment about she work .	constructive criticism
can a bad registry cause link not to work and can the ` cleaner ' cause all the problem ?	problem with the Windows registry
website that if i type in something , it will say it aloud , but in differnet accent ?	hear different accent for the same piece of text
anyone know any good site 4 listen to music for free other than playlist ?	free music site
do it cost anything to post a sale on ebay ?	multiple item for sale
INTERNET CONNECTED , BUT BROWSING TROUGH EXPLORER WONT work -- help plz !?	problem connect to internet
whn i vsit sum website t say ` sorry th website s nt availbl fr u r country ' i be frm indium wt 2 do ?	block website on a per-country basis
how we can come to know whether the article we be write be orignal or not ?	measure write originality
what be a music website that will not be block at school ?	block on most streaming music site
comcast internet work , then doesnt work , then work , then doesnt work ..?	Comcast internet provider
can you give I some feedback to make my blog better ?	improvement to my blog
what be the best way to promote you web host website ?	advertisement or word of mouth
be it rude to ask for a lower offer on ebay ?	internet explorer 8
be it illegal to download Japanese/Korean/Taiwanese tv show in the UK ?	the legality of download asian tv show
I keep get re-directed to other site when I open up my broswer ?	problem with browser redirect to site when open
what be a better browser to use : Mozilla Firefox or Internet Explorer ?	preference for Opera
ca not access website , could someone help I get this in ?	submit web form
can a virus/trojan/keylogger ect .corrupt or get into my connection ?	a malicious program change my computer 's setting
why can I download torrents fine , but internet page do not load properly -lrb- if at all -rrb- ?	problem view webpage but not download torrent
how do I restore previous website in the address bar in Firefox ?	restore Firefox browser history
I sell a item on ebay and the money go in my paypal account , now i want to use it to pay for a dvd i brough ?	wireless laptop
what be some photosharing website where people can pay u to download you pic ?	amateur photographer with a nice camera
if my friend have a webcam , can i still do `` video call '' with they if I have a skype account , but not a webcam ?	video chat with a friend
how do i get employment information on someone i take to court.they owe I money .?	website where teenager can walk around and chat
in opera browser , i try to change colour to Blue but it be still grey bar ?	change color in Opera
I recently block a site through my router , then unblock it why can i still not access it ?	router configuration
how can I make more money as a webcam girl ?	that website that look like Twitter
could this girl be lie or be she really tell the truth ?	buy now button
how much be adultfriendfinder and virtuagirlhd making and why be its ad everywhere ?	advertising revenue for common banner ad
when I close one internet Explorer Window all the other open ie Windows get closed !?	close ie browser window
if I buy something with PayPal , how will the purchase appear on my credit card statement ?	the full product name
I have a virus that i can not get rid of ... help !!!!!?	a unremovable virus
after upgrade from ie 6 to ie 8 I appear to have lose my Bookmarks , on the toolbar Bookmarks be shaded out ?	lose all my bookmark after upgrade to ie8
why I can not connect to the web use any browser but can connect use the my computer icon ?	problem connect to the internet
be there a website to make money work at home ?	guide for self employment
have anyone use HappyBidders before and win something before , be a scam or not .www.happybidders.com ?	veracity of happybidder prize claim
why do not they have a six month premium membership on deviantART ?	lack of a six-month premium deviantART membership
how do I get more vistor to come to my website ?	advertisement or word of mouth
where can I find low-size -lrb- 1 gb or so -rrb- torrent movie ?	download movie with small file size
Whats the website where it list phone number to company so you arent on hold ?	server host service provider with wordpress
how do I get rid of the `` favorite '' and `` history '' section on the internet Explorer Address bar ?	clear the information in the ie address bar
do i have to have paypal to buy something on e-bay ?	requirement for use PayPal
if u have 2 blackberry do u have to pay double internet ?	AT&T term of service
be there a site you can advertise stuff what be up for bidding free ?	advertising item online
HOW to make CALLS to MOBILE & LAND LINE PHONES USING INTERNET BROAD BAND ?	voip phone
how do you transfer you itune library to another drive -lrb- such as a external hard drive -rrb- ?	proxy list for use at school
what be the name of that website that look like Twitter ?	a block on Twitter in my country
do Formspring ever take a while to publish you answer ?	lockerz price
can you buy straight out on Ebay or do you always have to make a bid ?	Ebay bidding versus buying
do not we use the internet because we do not want to see commercial ?	avoid commercial
where can I do a reverse phone number look up that be 100 % free and DISCREET ?	a unknown number that call my phone
do you now where i can watch free older movie online without download ?	streaming vintage movie for free
how do i watch a show that restricted to a certain country ?	located in the UK
how do I get this magnification box to go away ?	2 kid in a sandbox
why be I get referrer on wordpress from random facebook link ?	best answer best point
how do i get the text in the textbox back after accidentally press the back button !!!?	restore textbox text after change page
where on the internet can I find a unstaged video of a girl dancing and strip naked on a bar room table ?	video of strip dancing on a bar room table
why be it someone always beat I to answer first ?	picture of what people would look like as the opposite sex
i just sell something on ebay and now im confuse on what to do next ?	what to do after sell a item
what be the best and safest place to setup a email account for my 14 year old teenager ?	everywhere i go on-line
do Paypal make I pay right away when I send money ?	timing of PayPal 's action
be there really a reverse phone search that be free ?	reverse phone lookup
